,Context before,token,Context after,Sense
0,"a yellow colour . It was filtered and evaporated , when it left a quantity of emulsine . The yellow",mass,"on the filter was treated with boiling alcohol , which became yellow , while the residue lost almost the whole",N
1,. In my paper on the Physical Properties of Ice this promise is fulfilled ; I have shown how a,mass,"of compact ice may be liquefied by pressure , in parallel planes perpendicular to the direction of the force ,",N
2,"cone in 7 minutes after the commencement of filling , which may be taken as the time in which the",mass,of iron in the cone had reached 21 Fahr. It was also found that the firm surrounding solid crust had,M
3,"perpendicularly towards that surface , saving an abatement that must be made for the inequality of pressure upon the central",mass,", when that is not in equilibrium . But if the central mass be infinitely , small , whether it",N
4,"took place ; and , when this had subsided , the whole was poured into a proper vessel . The",mass,", when cold , was grayish-brown . Boiling distilled water was poured upon it ; and the brown residuum ,",N
5,"are curious foot-shaped bones , and are extremely solid , especially the dentigerous "" toe""-\#151 ; an oblique , oval",mass,", looking straight towards its fellow , from which it is separated by a space half the width of the",N
6,", be represented by A'x , Bly , B z : and in like manner the attractions of the interior",mass,"abc upon the particle , may be denoted by 141 A "" x , B "" y , and the",N
7,"extends to infinity and the total mass is infinite ; when , the matter extends to infinity but the total",mass,"finite ; when , the matter is of finite extent and of finite total mass . As increases the variations",M
8,"of Anthocem but morphologically speaking , in both cases we have to deal with sterilized cells of\#171 ; potential sporogenous",mass,", and in both cases the organisms concerned are such a give good reason to recognize in the presence of",N
9,", with potash ; and this idea is favoured by some trials that I made to separate silex from the",mass,", by boiling it in concentrated fluoric acid ; the substance did not seem to be much altered by this",N
10,"the rubian was entirely decomposed . The filteired liquid left on evaporation a quantity of sugar , and the residual",mass,"on the filter , which was interspersed with numerous small yellow crystals , was treated with boiling alcohol , which",N
11,perhaps partly also by the action of the ordinary precession and the contraction and change of ellipticity of the nebulous,mass,. * ' ' Precession S 19 . If the change has been as much as an hour the rotational,N
12,"the experiments now under consideration . Further , the strength of induced currents depends on the conducting power of the",mass,"in which they are formed . Expressing the conducting power of bismuth by the number 1*8 , that of copper",N
13,the opening-up and widening of the primordial fissure in which the notochord lies ; for the moieties of the investing,mass,are seen to press closely on the notochord in the first stage ( Plate LXXXI . fig. 2 ) the,N
14,and copper pyrites it is probable that the thallium is here present in the form of Crookesite disseminated through the,mass,. The optical of detecting thallium in a mineral is very simple . A few grains of the ore are,N
15,"as the compass , the correction is much more simple . It is only necessary then to introduce a single",mass,"of iron at the starboard or larboard side , and at the same level as the compass . For the",N
16,Let us now conceive the 1000 feet of sedimentary mass of lower conductive power to be deposited upon the unstratified,mass,. The escape of the heat would at first be impeded till the temperature of the bottom of the sedimentary,N
17,lowering of temperature produced by removing a quantity of heat equal to t -dT mx~ dt ' from an equal,mass,of liquid unchanged in form . For water T=2'96 gr. per lineal inch . Work per square inch spent in,M
18,", it would seem that the only conceivable causes which can affect the degree of solidity or fluidity of the",mass,", are temperature and pressure . It may be doubted by some persons whether solidification be actually promoted by the",N
19,". , and for mt.pg . read OF THE SKULL IN ' LEPIDOSTEUS OSSEUS . turn passes into the investing",mass,"( iv . ) below . There the cartilage is a thick wedge , right and left , and the",N
20,"mean solar day , Combining these values I find for the earth 's rotational momentum Writing for the moon 's",mass,", and neglecting the eccentricity of the lunar orbit , the moon 's orbital momentum is * If we determine",M
21,"the subarchesporial pad , has its physiological interest . The sporangium is an unusually large one , and the spore-producing",mass,"very bulky ; the difficulties of supply of nourishment to so large a mass are obvious , and would be",N
22,", vertical below it ; still this difficulty may be due to our ignorance of the mechanical conditions of the",mass,during its descent . In this way it would be quite possible to fritter away conviction to a mere opinion,N
23,Phiiosophy ' as generally confirmatory of Thomson 's view as to the great eifective rigidity of the whole earth 's,mass,". There is one tide , however , of long period of which Laplace 's argument from friction must hold",M
24,be the same in all the observations which shall be made according to this system . For the unit of,mass,", then , we may take a grain ; for the unit of time a second ; and , if",M
25,many solutions . It is allowed on all hands that there is a rmutual connexion between the figure of a,mass,"of fluid and the attractions it exerts upon its particles : the relation which these two things , alike unknown",N
26,"of parts which is perpetually presented to the student of natural science . In the latter case especially , the",mass,"of horn in close contact with the skull , and therefore capable of transimitting heat directly to the animal 's",N
27,"of the great difference between the direct action of a force on a solid , and that on a fluid",mass,", in its tendency to produce rotatory motion . We have seen , in fact , that the disturbing forces",N
28,"( which for convenience the author calls the "" enclosed space , "" ) marking the boundary of an irregular",mass,", which is the only part of the earth 's surface that appears to have a sensible effect on the",N
29,doubt for a considerable period and under exceptionally favourable circumstances . Had not the subterranean pressures increased and driven the,mass,"upwards , and the temperatures at greater depths been so high as to render the ascending forces irrepressible , the",N
30,", x 1000 . [ 251 ] VII . The Stability of the Pear-Shaped Figure of Equilibrium of a Rotating",mass,"of Liquid . By G. H. Darwin , F.R.S. , Plumian Professor and Fellow of Trinity College , in the",N
31,being spheres . The object of all these investigations is to apply the formulae to a concrete example . The,mass,"of the system is therefore taken as equal to that of the sun , and the limit of the swarm",M
32,". ) . It also takes in the lower face , with the tongue ( tg . ) . The",mass,"of soft tissue under the olfactory lobes will be differentiated into the cribriform plate , the olfactory nerves passing through",N
33,"a certain period o\#177 ; their formation , become covered with a cold , non-luminous crust . If the glowing",mass,"bursts forth , the chemical combinations which have formed on the surface , under the influence of a low temperature",N
34,"Thus , when the heated wire is enveloped in a considerable body of gun-cotton , the ignition of the entire",mass,"is apparently not instantaneous , if attempted in a highly rarefied atmosphere , because the products of the combustion first",N
35,"but little difference . The vibrations of greatest wave-length are put in evidence , both in the compressible and incompressible",mass,", by the displacement of the surface . A vibration in which the displacement is proportional to a zonal harmonic",N
36,"9 and 10 . ) . Here , then , the posterior grey substance again consists only of a single",mass,", and again , also , the stubstantia gelatinosa extends uninterruptedly and nearly horizontally across from side to side .",N
37,"Allowing the light from a window to fall upon the ice at a suitable incidence , the interior of the",mass,"was found filled with little flower-shaped figures . Each flower had six petals , and at its centre was a",N
38,derived from the centrifugal force by means of the equation f= B'A ' 10 . The level surfaces of the,mass,"in equilibrium are properly the interior surfaces similar to the outer surface , and similarly posited about the common centre",N
39,thirty-five different kinds of wood : TABLE I. Name of wood . ~Deportment of Deportment of Name of wood .,mass,. structure Remarks . 1 . Beef-wood . Diamagnetic . Fibre equatorial . 2 . Black Ebony ... ... ...,N
40,"and more elegantly formed . The unossified auditory floor ( fig. 7 ) is now a more transverse , sub-oval",mass,", and the projecting , descending lip of the floor is very small ( Plate 11 , figs. 7 and",N
41,. It is clear therefore that the halogen atom cannot simply replace a hydrogen atom so that the centre of,mass,of the former occupies the same position as the latter . This follows from the fact that the mass is,M
42,"tension is to separate the contiguous particles , and thus produce a finite fissure , or a discontinuity in the",mass,. It is resisted by the normal cohesive power ; and in like manner the transverse or tangential action is,N
43,to mark ( in chain-dot ) on figs. 2 and 3 the outline of this Jacobian ellipsoid of the same,mass,as the dumb- bell . The actual vertex of the ellipsoid just falls outside the limits to which it was,M
44,"of azomethine are not singular in the fact that gelation starts from centres , and only slowly involves the whole",mass,", is proved by an observation made by me many years ago . A solution of silicic acid was dialysed",N
45,to bear this stress . We are thus led to inquire how the stresses are distributed in the earth 's,mass,", and what are their magnitudes . These points cannot be discussed without an hypothesis as to the interior constitution",M
46,"of which belongs to the "" ' atlas . "" Outside the carotid groove the periotic portion of the investing",mass,"becomes scooped into an oblong rounded sulcus . This sulcus has only a low wall in front , but is",N
47,"its outline is not so clearly defined as I could have wished , owing to the density of the vegetable",mass,"in which it is imbedded . I see traces of the lateral grooves , especially at k , but these",N
48,Internal nostril . i.sp . Inter-suspensorial . i.st . Inter-stapedial . i.tr . In ter trabecula . iv . Investing,mass,. 1 . Lacrymal . l.l. Lower labial . V- Labial fontanelle . l.v. Lower velum . lx . Larynx,N
49,"as we recede from the centre the number of small ones preponderates more and more , and thus the mean",mass,continually diminishes with increasing distance . The loss by evaporation falls principally on the small meteorites . A meteor swarm,M
50,"point to the atmospheric pressure p , . In such case water might pass from the upper surface through the",mass,", along any number of smooth tubes like those above described and communicating freely with each other . The pressure",N
51,"sizes . The granular masses are apparently nucleated in D. and E. A. Epithelioid cell , containing a small granular",mass,", and a nucleus . DR. H. WATNEY ON THE MINUTE ANATOMY OF THE THYMUS . 1113 Fig. 45 ,",N
52,"to show that when , and are allowed to take their natural values as determined by the configuration of the",mass,", this result is no longer true . The spherical symmetrical ement appears always to be stable . 2 .",N
53,to close in and accommodate the dimensions of the shell to those of the . nucleus beneath ; but the,mass,"is tlansferred , it is not lost ; and the transfer might hay no effect whatevel on the length of",M
54,") , its nucleated network was arranged in a connected series of arched radiations , which extended into the pyriform",mass,of grey substance on the same side ( b ) . From this substance another very evident series of separate,N
55,"of subarseniate of soda , dried by the spirit-lamp , was reduced to powder , and calcined anew with a",mass,"of carbonate of ammonia in the same crucible , so that the maximum absorption of carbonic acid ( as it",N
56,"the wrought-iron bars , when the conflagration had subsided . The brilliant yellow flame characteristic of the burning of a",mass,oi gun-cotton was not observed at any period throughout the experiment ; but about one hour after the fires were,N
57,"whether these small globules constitute the substance thrown out in inflammation , Mr. BAUER examIined a small portion of a",mass,"of coagulable lymph taken from the vagina of an ass , where it had been deposited by a violent attack",N
58,", as in equation ( 98 ) the former paper , be identical with constant . FIGUlffi OF A ATING",mass,OF LIQUID . Let us ourselves to the terms in } . Using the value of given by equatio1l (,N
59,"regular motion , we are certain that the mechanism of a glacier is continued within the small compass of a",mass,which may be conveniently examined in detail in all its parts . It is lodged in a niche of the,N
60,"prevailing pressure , the weight added during experiment . doparts from strict accuracy ] in so far as it unit",mass,"of water to occupy unit volume at the temperature the for lacement.\mdash ; In a many the vast of ,",M
61,"number depending upon the arrangement of the particles in the interior of the mass , M1 representing the earth 's",mass,", and a ' the present polar radius of the earth , which , without sensible error , may be",M
62,"; and when its position was reversed , its action was representative of that of a heated or relatively diamagnetic",mass,"of air . Bringing this helix into the vicinity of small magnetic needles , suspended either freely , or so",N
63,"a temperature which would just admit of the containing rock becoming solid , while it sufficed to preserve the fluid",mass,"in a state of fusion . Let us then suppose an elevatory force , produced by the expansion of the",N
64,"G , V ( r ) will represent the sum of the quotients of all the molecules of the whole",mass,"divided by their respective distances from a m ; let V ' ( r ) denote the same thing ,",N
65,middle part to the intertrabecula ( i.tr.).The orbital muscles ( or.m . ) are planted in chinks of the basal,mass,. This section is in front of the mouth and through the front of the upper lip ; there is,N
66,"diamagnetic body , on being raised or lowered , is alwaysfrom the equatorial to the axialposition . If the elongated",mass,"be magnetic , and the shortest dimension of the mass tend , in virtue of its structure , to set",N
67,") ) =-Pn)_ ) ; tl-t(n ) t(n)-4t ) p tt , -T t2--rT q The conductivity of the actual",mass,"being k , and the thickness H , we have t ( n ) ( n ) pH t ?",N
68,which influences the result remains the same : one conductor has simply been . substituted for another . The great,mass,"of the magnet might be supposed able to do something more than the thin wire , but the reason why",N
69,"of the dust cloud must have been considerably greater than that of any wind , for the weight of the",mass,", or rather its momentum , is high , owing to the density of the mixture of gases and of",M
70,"and therefore not necessarily destructive of cohesion , which may be termed a bruise . A glacier is not a",mass,"of fragments.-As the analogy of the glacier to a river , in which the fluid : principle is greatly in",COL
71,"added , and the whole was strongly heated , during half an hour , in a silver crucible . The",mass,"was then dissolved in distilled water , and , muriatic acid being added to excess , the liquor was evaporated",N
72,necessary to take notice of the perturbation of the sun . In consequence of the largeness of the sun 's,mass,it was not there requisite to make a complete investigation of the theory of a planet attended by a pair,M
73,"density . a. If the mass is colder than the ball , it repels the ball . h. If the",mass,"is hotter than the ball , it attracts the ball . "" II . When the ball is in a",N
74,"at the same time part of the quicksilver rises in its metallic form , and also part of the white",mass,", united in all probability to a greater proportion of acid than before , sublimes ; so that the rationale",N
75,"the foregoing pages . The very first experiment that I made on harbour-boats at Portsmouth , proved that a single",mass,"of iron protected fully and entirely many sheets of copper , whether in waves , tides , or currents ,",N
76,"an abundant one took place-lime water produced only slight turbidity , The muriate of soda amounted , in this saline",mass,"of fortyfive grains , to thirty-five grains , or nearly to one grain in 450 of expectorated matter ; the",N
77,far below the value to which our analysis has led . 56 . Consider the simplest problem of a spherical,mass,"at rest , the equations of equilibrium being where is the gravitation constant . If is the pressure at the",N
78,"tr . ) , from which the notochord ( nc.)is retreating , are obliquely marked off* from the newer investing",mass,"behind , which has not yet finished the occipital condyles nor even the occipital ring . Hence the fontanelle (",N
79,"simply adopted the first formula above given , which , as it supposes the density constant , will make the",mass,"of air traversed appear too small , producing in his results an accidental compensation of errors to which we shall",M
80,"ix . , plates 54 and 62.)* The nasal wall is beginning to bend inwards to make room for a",mass,"of subcutaneous follicles , which become collected into a glandular mass inside the inferior turbinal ( see figs. 6 and",COL
81,"to be unity . If the external potential of be , and if be an element of volume or of",mass,"of , the lost energy to be evaluated is integrated throughout the ellipsoid Let us suppose provisionally that the co-ordinates",M
82,"of the glacier . ( 3 ) Many glacial valleys become narrower as we descend them , and consequently the",mass,"of the glacier may enter each part of the valley as a wedge , and may frequently become more or",N
83,good model from which to study the behaviour of compressible masses has on the whole been fully confirmed . A,mass,"of incompressible matter , shrinking while rotating , will assume first the shape of a spheroid , then that of",N
84,that they are equal . The Measurement of Mass . 40 . Since it was not necessary to refer the,mass,"to a general standard , the weights used were only referred to a Board of Trade standard for convenience .",M
85,"it is proposed to treat in this paper , namlely , that relating to the figure of equilibrium of a",mass,"of fluid , the particles of which are subjected to the action of accelerating forces . This problem , suggested",M
86,When the temperature has fallen to the solidus Ic the alloy is a uniform solid solution . It is a,mass,"of crystals , chemically identical , but forming crystalline grains differently oriented and therefore showing , after etching , differences",N
87,showing diminuticu of mcan mnss centre to outside . SSOR G. H. DARWIN ON THL CHANICAL CONDITIONS The uation of,mass,"in the ) , where collisions are supposed to be non-existent , is not very difficult , although it ]",M
88,"cube was horizontal . Previous to heating the rocker , I laid it , according to practice , upon the",mass,", merely to ascertain whether the arrangement was likely to answer . To my astonishment a deep musical sound commenced",N
89,been able to satisfy myself whether the lower layer of the nucular membrane ( f ) passes under the cellular,mass,( p ) or whether it merely becomes merged in its cells . but I think that the former is,N
90,"defined in "" "" Harmonics S 5 . The Determincfhon of Gravity on ROCHE'S Ellipsoid . In ROCHE'S problem a",mass,"of liquid , which assumes approximately the form of an ellipsoid , revolves in a circular orbit about a distant",N
91,\#151 ; that the detonation of 0'5 ounce ( 14'2 grms. ) of compressed gun-cotton will induce that of another,mass,"of gun-cotton if separated from it by a tube , of a particular diameter and thickness , 2 feet in",N
92,foregoing experiments demonstrate that the rate at which detonation is transmitted THE HISTORY O EXPLOSIVE AGENTS . from mass to,mass,of dry compressed gun-cotton ( the individual masses being in actual contact with each other ) is between seventeen and,N
93,"direction of the line joining p and p ' . Definition ( GREEN).-This function , which , for a given",mass,", has a determinate value at any point , P , of space , is called the potential of the",N
94,"and we haveDistance of the middle from A , measured along the chord . Deflections , caused by a semi-cubic",mass,", 200 . i miles in each horizontal side , and 100 miles 379 miles . 581 miles . 781",N
95,that the quantity of heat which it receives from the rocker during contact is instantaneously distributed equally throughout its entire,mass,", then , although the total expansion might be very great , there would be no local expansion at all",N
96,"channels , and the relative velocities of the top and bottom , the sides and centre of such a pasty",mass,"were displayed by the alternating layers of two coloured pastes , which were successively poured in at the head of",N
97,"no coloration to the flame , and obstinately retained its fluorine to the last , as was shown by the",mass,giving the usual reaction of fluorine when treated on a glass plate with sulphuric acid . Conclusion . . These,N
98,and substance are uniformly at one and the same temperature . This interval of course varies with the nature and,mass,"of the substance . In accurate work sufficient interval must be left to leave no doubt on the matter ,",M
99,accord with the effects of induced currents . Time has great effect over results produced by currents induced in the,mass,", and none over those due to polarity . By this test the effects of the diamagnetic metals are found",N
100,"were held . Sooner or later the cohesion of the liquid was overcome , and from a spongy froth the",mass,"changed to a cloud of particles , mostly solid , hut , pei haps , m * MM . A.",N
101,", but such will not be the case . For the complete wedges , not reaching down to the fluid",mass,", will not be immediately acted upon by it at all , and the truncated wedges , whose narrower sides",N
102,in the opposite half of the nucleus across the central line at G. Many of themare evidently derived from a,mass,of epithelial cells situated at E between the bases of the posterior pyramids . The anterior portion of the spinal-accessory,N
103,is proper therefore that both in the construction of the ship and in the fixing of correctors ; no large,mass,of iron should be placed below the compass . The expression for disturbing force towards the ship 's head is,N
104,fifth nerve ( 5* ) . The bony bridge made by the prootics from the fore part of the investing,mass,"articulates in front with the "" basisphenoid "" ( Plate VII . fig. 4 b.s. ) , and behind with",N
105,"nucleus of the auditory nerve , and contains many cells of a larger kind . The inner side of the",mass,consists of an oval group of large multipolar cells of the same shape and size as those of the anterior,N
106,fluids and A if the density of A on the composite surface be put equal to that of A in,mass,". is the mass of A per unit area of surface . The part of the curve , of unknown",M
107,"bending . As we expected to determine the water equivalent with as much accuracy as other quantities , the large",mass,of the neter did not appear to be a serious objection . The whole of the calorimeter was heavily gilded,M
108,"to purify it , it is dissolved in alcohol , and the filtered liquid is evaporated . The residual fatty",mass,"is pressed between blotting-paper , in order to absorb as much as possible the more fluid portion , and it",N
109,"if ignited at the lower inner portion of the mass , where the part first inflamed is enclosed by the",mass,"of the material itself , it exerts a destructive force little inferior to that of the chloride of nitrogen enclosed",N
110,of temperature take place it is probably to be expected that it would be so rapidly diffused throughout the whole,mass,as to occasion no perceptible change in the relative distances of the microscopes from each other * . During our,N
111,"colours and spectra will be identical . If , hoover , the masses are very different , then the smaller",mass,will run through its changes at a much greater rate than the larger one . In this way it is,M
112,", which acts through the mnedium of the fl-uid of the Graafian vesicle . The particular structure originating that fleshy",mass,", I shall have occasion to refer to in connexion with the oorpus luteum ( par . 156 . )",N
113,"this directive action in the highest degree is carbonate of iron : when a lozenge , cloven from the crystalline",mass,", is suspended from the angle at which the crystallographic axis issues , there is great difficulty in causing the",N
114,"determine a large osmose , are , further , all of the class of chemically active substances , whilethe great",mass,"of neutral organic substances and perfectly neutral monobasic salts of the metals , such as the alkaline chlorides , possess",N
115,"carefully drawn enlargement of a portion of this branch-section . Here , again , we have at c the compact",mass,"of vessels forming the medullary axis , radiating from which we have a series of vascular wedges ( d )",N
