,Context before,token,Context after,Sense
348,"the ovum is con ? vey ed , is uniformly that directed towards the surface of the ovary . The",mass,"of granules escaping with the ovum on the bursting of a Graafian vesicle under the compressor , is composed chiefly",COL
349,"a mean radius according to the law of error , and if be the diameter of the meteorite of mean",mass,", and be the density of the distribution of meteorites in space , and their mean kinetic energy of agitation",M
350,"The sub-archesporial pad is much more developed , and is at times extended pocesses of tissue which penetrate the sporogenous",mass,for a short distance . 5 The stalk of the sporangium is much thicker and shorter than in Selago .,N
351,"of these . 1,7 Greatest error from error in mass of Venus . + 1""5 Greatest error from error in",mass,"of Mars.+ 1,9 Greatest error from error in mass of the Moon.+ 10 Greatest possible negative error.1."",7 Greatest possible positive",M
352,it or gases be evolved by chemical action increased by the heat . When water does reach such a heated,mass,"of clumbled rock , it leadily finds its way through the whole mass , which absorbs it as red-hot sand",N
353,"be this peculiarity in the appearance of the copper , that unless the protecting metal below was in very large",mass,", there were no depositions of calcareous or magnesian earths upon the metal ; it was clean and bright ,",M
354,epoch a vertical liiei drawn down to a sufficient depth from any place in the surface will pass through a,mass,of matter which has remained the same in amount all through the changes . By the process of expansion the,N
355,"no influence , always set equatorial , I proposed to set this tendency to contend with an elongation of the",mass,"in a direction at right angles to the fibre . For this , purpose thirty-one little wooden bars were carefully",N
356,upon the values of the components and of d. As the value of I depends upon the form of the,mass,", it must also depend upon X , Y , Z ; but it may be considered independently if the",N
357,"of the volume density \#151 ; p in R , and the positive condensation + Con J , the total",mass,"being zero . Let z , a proper fraction , define a surface between J and the pear . Consider",M
358,which must exist when the two masses approach so near to one another as just to coalesce into a single,mass,. When the two masses far apart the solution of the problem is simply that of the equilibrium theory of,N
359,"the fact that , according to my theory of their constitu-tion , there will be no constant relation between the",mass,"of a swarm and its brightness . When we see a "" star "" of a certain magnitude , we",M
360,"' ) ; and , by integrating , the sums of the like attractions of all the molecules of the",mass,"are obtained , viz. xf dm -f a dm , if dn -fy'dm , zf dm -fz'dm . Now ,",N
361,"considerably and afterwards , after the lapse of upwards of one year , becoming converted into a somewhat hard gum-like",mass,". In the case of the second and third samples , the coloured vapours disappeared at first almost entirely ,",N
362,"the calculations of that Paper the following instance occurs ( p. 46 , in the Table ) . A tabular",mass,"only about 600 feet high , and measuring thirty-seven miles by forty-six , will cause a deflection of 3""172 at",N
363,We can ) judge of probable results from the investigations which have been made concerning the stability of a rotating,mass,"of liquid . Now , it appears that the instability of a ating mass of liquid first enters the graver",N
364,"drainage in a centrifugal machine ) was firmly rammed into the shell , a central cavity being formed in the",mass,"to receive the "" primer "" of dry gun-cotton ; water was then poured in , so as to fill",N
365,It was not difficult to establish the nature of these two compounds by numbers . The solution of the saline,mass,"in absolute alcohol , deposits , on cooling , beautiful prismatic crystals , consisting of the bromide of bromethyl-trimethylphosphonium almost",N
366,for the lateral lobe of the cerebellum ( Plate XIII . fig. 4 ) ; and in the back.of this,mass,", towards the top , is the epiotic ( ep . ) . Here is seen the suture between the",N
367,to the inequalities of its valley as a viscous mass would do . This was equivalent to saying that the,mass,"was viscous because it moved in a particular manner , instead of asserting that the mass movced in that particular",N
368,perfectly accomplished . Nevertheless there are indications that such a separation is in progress . Thus we see at a,mass,"of cellular tissue separating the vascular masses on either hand of it ; not only so , but we discover",N
369,", since rigorously , Hence , our equation is . ( 29 ) It is obvious the is the whole",mass,( expressed in terms of the mass of the isothermal sphere ) enclosed inside of radius . The differential equation,N
370,"in consequence , probably , of the wire gradually allowing its axis to pass more nearly through the centre of",mass,", but we can easily reproduce it in all its intensity by jarring the wire , or even sometimes by",M
371,runs up half way to the frontal wall at right angles to the fore part of the head ; this,mass,"of tissue is the "" middle trabecula of Rathke : a transient structure , as he pointed out . Along",N
372,Bessemer flame . V. The line of increase of temperatures of the swarms of meteorites and subsequent cooling of the,mass,"of vapour produced , and the accompanying phenomena , may be provisionally stated as follows : 1887 . ] 'a",N
373,"S The element on the ulnar side , the ulnare of the adult , is a much smaller , sub-crescentic",mass,"of cartilage , lying to the free side of the pointed extremity of the ulna , but wedging its way",N
374,the temperature in the interior of a glacier may be affected-(1 ) conduction of heat from the superficies of the,mass,"according to the ordinary laws of conduction through solid bodies , and ( 2 ) infiltration of water from the",N
375,"solid will form , until finally a temperature is reached at which the last drop of liquid solidifies and the",mass,"becomes wholly solid . This temperature is a point on the "" solidus , "" and the curve passes through",N
376,"residual or other effect which tends to disturb it , and it remains still . 2330 . If the whole",mass,"be moving parallel to itself , and be small in comparison with the face of the magnetic ple oppositeto wich",N
377,"rudiments of the ' "" parasphenoid . "" 770 which is a crest of cartilage altogether continuous with the investing",mass,", and the root of the corresponding trabecula : this part will be better shown in the description of the",N
378,"measure of the energy involved in this , that it is equal to more than the work of the entire",mass,"of the spherical shell of miles thick dropping through 47 miles , we derive some idea of the prodigious energy",M
379,"taking the simplest case , that of one element ; when the sun cools it will be a very complex",mass,chemically . If the laws of evolution hold we need not expect that this will largely increase the complexity of,N
380,"external source , to the gases as they escape and expand , or by establishing the change in a greater",mass,"of the material , and thus reducing the rapidity with which the heat will be con . veyed away by",N
381,"this conclusion when the investigations of the last two sections were carried out , a rent law of frequellcy of",mass,would have been assumed . But the results of those sections are amply sufficient to indicate the conclusions which would,M
382,"whereas , in the iron ship , there are no actual joints , for the whole being bound together en",mass,", the same , or nearly the same , strength is obtained as if the whole ship were composed of",Q
383,"and the back wall of the cochlea shows by transmitted light the cavity itself , and the enclosed lower otoconial",mass,. Mesiad of the stapes the internal carotid ( i.e. ) is seen as it runs forward to gain the,N
384,tension of a composite surface composed of a fully separated layer one fluid ( say oil ) spread over a,mass,"of another fluid ( say water ) is given by the equation , ( 1 ) where A and denote",N
385,"4r2 sin2 122 Integrating with respect to 4 , , from 4=-2 3 to 3 attraction on A of the",mass,"standing on qq ' in direction AT g sin cos8d8 A2 g sin cos-8dA = , % 12\k'cos ---n2 !",N
386,"and the above process will be repeated , the velocity increasing till the continuous action of the plane on the",mass,becomes equal to the weight resolved in the direction of the plane . During this time ( probably too short,N
387,"that unless the disturbing forces were very great , the position in space of the axis of rotation of the",mass,"would be much less affected than if it existed in the solid state . Let , in addition to the",N
388,"p40=3 419 33.55 41 . a41=35-26 ; 41=3 600 37-06 42 . a42=38,86 42=4-314 41P01 When part of the attracting",mass,"is near , and therefore w is not so small that it may be neglected ( as in art .",N
389,"loo grains of it with one ounce of concentrated sulphuric acid , after some time , formed a blackish soft",mass,"; a second ounce of sulphuric acid was then added , and the whole was digested and occasionally heated during",N
390,"proved by the following:\mdash ; Molecular of , density Ratio of crystal-axes : 1 : NIass of the hydrogen atom",mass,of unit rhomb of 4 molecules also grrIl . Then from the known axial ratio values of we find cm,M
391,"a single puncture of the large septate sporangium by animal , or other agency , would probably destroy the e",mass,"of spores , if the sporangium were septate only one compartment would r. It is clear then that where the",N
392,that time generally entertained would have been conclusive against the hypothesis of plasticity called forth by the gravity of the,mass,". So far , then , as appears from his writings , DE SAUSSURE considered the ice of glaciers to",N
393,"molecular structure of the bismuth . A bar of this substance , cut in a certain manner from the crystallized",mass,", exhibits between the poles of a magnet precisely the same visible deportment as a bar of iron , while",N
394,"If the magnitudes are very unequal , we may take the one with tfca smaller magnitude as having the smaller",mass,", and if it is proportionately in advance , as indicated by its spectrum , or colour , we roa/",M
395,"tension . If the resisting power of the ice give way to the maximum pressure at any point , the",mass,"will be crushed at that point , but its continuity will be immediately restored by regelation , the internal constraint",N
396,"penetrated is more distinctly stratified , and consists of beds of a much greater variety than is found in a",mass,"of chalk . They have , however , for the most part , the common character of being very siliceous",N
397,parasphenoid . All the true axial parts of the skull cease at the fore edge of the investing,mass,"behind the pituitary space ( pie . ) ; all the rest has a facial foundation , is built on",N
398,"the dorsal region . The anterior cornua are rather small and pointed , and contain each a circular or oval",mass,of vesicles . The central portion of the grey substance surrounding the spinal canal is described by FOVILLE* as the,N
399,"grouped , according to a law of frequency , about ) a certain mean radius , and molecules of infinite",mass,"were considered to be with , of course , infinite rarity . Now , if we were to continue to",M
400,one rotatory velocity with which a spheroid of a given figure will be in equilibrio . But when a fluid,mass,"is to revolve in a given time , and the figure that will maintain the equilibrium is sought , there",N
401,moving metal ) the lines of particles through which the induced currents tend to move are parallel throughout the whole,mass,"; and therefore , as there is no part by which the return of the current can be carried on",N
402,"auxiliary function . \v . h2 , + ; 1 + a ; "" FIGURE OF EQUILIBRIUM OF A ROTATING",mass,OF LIQUID . The equations to be satisfied by the ellipsoid afford expressions for odfq2 and aPcf in terms of,N
403,to itself ; for under such circumstances the forces are equal in both directions and on both sides of the,mass,", and the only tendency the crystal has , in relation to its magnecrystallic condition , is to turn round",N
404,all parts of the mass are permeated by ducts of any kind through which water can flow out of the,mass,with little impediment . Hence it appears that if the internal ducts were such as not to impede the currents,N
405,"to them . It can be conceived , however , that the blow , or gas-wave , to which a",mass,composed even of quite loose fibres is opposed may be so sudden in its operation that the particles which it,N
406,"segment , but the non-segmented counterpart of several . On each side of the end of the notochord the investing",mass,"at first grows outwards in an angular manner ( shown in Professor HUXLEY'S fig. 57 F ' , and in",N
407,"this part of the brain . Now this centripetally growing floor is derived , behind , from the "" investing",mass,", "" laterally from the trabeculae , and in front from their secondary commissure . In this figure , which",N
408,assume the solid state . As solidification must proceed very slowly from the slowness of the refrigeration of the entire,mass,", it is evident that the thickness of the stratum may be considered indefinitely small compared with the radius of",N
409,". In general it may be remarked , that if one mass of iron is placed exactly opposite another equal",mass,", both in azimuth and in elevation , it doubles its disturbing effect ; if one mass be placed opposite",N
410,"D ) show a continuity of these bands both with each other in front , and with the "" investing",mass,"of the notochord behind ; this will be illustrated in my 44 third stage . These bars ,",N
411,"of hydrogen per minute . The platinum tube employed here was joined without solder , having been drawn from a",mass,of platinum which had been aggregated by fusion . It was similar in this respect to the tube employed by,N
412,"beginning to bend inwards to make room for a mass of subcutaneous follicles , which become collected into a glandular",mass,"inside the inferior turbinal ( see figs. 6 and 7 ) . The nasals , septo-maxillaries , vomers , and",N
413,poles and being discharged right and left at very small distances comparatively ; and as it exists in a thick,mass,"of metal possessing almost the highest conducting power of any , and consequently offering extraordinary facility for its production and",N
414,"descent of the glacier to the daily congelation of the water which percolates it , and the expansion of its",mass,"consequent thereon , whilst it assigns a cause which , so far as it operates , cannot , as I",M
415,lose matter equatorially with even the slightest amount of rotation . For all except an infinitesimal fraction of the whole,mass,"is concentrated in regions near the centre , and the potential near the edge may accordingly be taken to be",M
416,"the space OPR , and of its centre of gravity through ( gm+hn ) , the centre of gravity of",mass,"of fluid of which it forms a part , and whose weight is W , is raised through the space",M
417,"a considerable groove . On the inner face , where the cochlear and opisthotic regions unite , there the bony",mass,"is notched twice , to let out the 9th and 10th cranial nerves ( IX . , X. ) .",N
418,", and soon they broadened till only a narrow passage was visible between them to the north . "" The",mass,"of falling debris seemed to be closing in upon us , and in a short time it fell , enveloping",COL
419,"surface : assuming the height of the equiponderant column of a uniform atmosphere at 3911 toises , he finds the",mass,"traversed at 450 of elevation to be 5530 toises , and at the horizon 138,823 toises . Notwithstanding that he",M
420,", we have the following results:mass on Known Region 3 0-1679616 x 0'7761 mass of the earth 8r r= 0'000003890",mass,"on Doubtful Region 3 0'7555430 x 1'0852 mass of the earth 8rr =0'000024367 . mass on Doubtful Region Hence ,",M
421,the ice at the bottom of the glacier will be the more rapidly overcome by increasing the depth of the,mass,", the area of its base being unchanged . Consequently the tendency of a glacier to descend down its bed",N
422,a nucleated granular mass like that whichforms the early condition of all structures . At first an elongated delicately granular,mass,"is observed in connexion with nervefibres , more or less of an oval form , tapering into a tolerably broad",N
423,"roof , on which the bony "" wall plates "" he . The front tegmen runs forward as a wedge-like",mass,", for it has coalesced with the more developed intertrabecular crest , and the "" lamina perpendicularis "" ( p.e.",N
424,"effect on A , is fairly represented by our geometrical figure . The last formula gives , Attraction of tabular",mass,on the same base =0 000i1563 g. k. That this may be the same as the attraction of the geometrical,N
425,"flow of a river , in which the slighter variations are absorbed by the predominant inertia of a comparatively stable",mass,". Now the glacier of Bossons is , as every one who has seen it knows , a mere icy",N
426,to one inch . PLATE XXVII . Consists of three figures . Fig. 1 . The gastric glands in one,mass,", and the oesophageal glands , with the orifices exposed ; of the natural size . Fig. 2 . The",N
427,water in air was taken instead of the weight in . Now the correction of the apparent weight of a,mass,"of water when weighed with brass weights amounts W. W. . On the whole , therefore , we must take",N
428,"effect were wholly due , as far as the crystal is concerned , to an original power inherent in the",mass,", we might expect to find the earth 's magnetism , or any weak magnet , affecting the crystal .",N
429,"Mammalian vomer ( Plate 15 , fig. 3 , side view ) ; but the middle wing is a solid",mass,"with an oval outline . This lobe or wing did not peel away easily , like the other , as",N
430,"let us collect these results , and express them in terms of instead of . The solution is And the",mass,inside of any radius is And when The length of the modulus at the surface is of the planet.s radius,M
431,on the interior surface of the shell will be produced by the mutual attractions of the particles of the whole,mass,"fluid and solid , the centrifugal force on the fluid , and the disturbing forces of the sun and moon",N
432,"of stout metal ( sheet iron ) , the detonator being so applied as to be closely surrounded by the",mass,to be detonated ( i. e. inserted into a perforation in the piece of compressed gun-cotton ) . If there,N
433,"angular velocity , the determination of the figure of equilibrium may be treated as a statical problem , if the",mass,"be subjected to a potential The energy lost in , the concentration of a body from a condition of infinite",N
434,"first , that the accelerating forces acting in the directions of the co-ordinates be , in every part of the",mass,", the same functions of the co-ordinates ; and , secondly , that these functions possess the conditions of integrability",N
435,"meridian deflections 27""'845 , I1""'965 , and 7""`207 . These quantities , as calculated from the attracting MiDCCCLV . 0",mass,"in art . 43 , are 27""`853 , 1'V968 and 6""I909 , which show how good an approximation the formula",N
436,. This and the next are the last sections in front of the notochord ; the moieties of the investing,mass,", or parachordals , form here a mere lip to the lower edge of the auditory shell [ au .",N
437,"conductlng it , or giving it a passage ; ill short that heat is incapable of passing thro4gZ ) a",mass,"of air , penetrating : from one particle of it to another , and that it is to this circum$tance",N
438,"several truly distinct parts . In the Bird ( chick ) the distinctness of the trabeculae from the "" investing",mass,"is best shown during the second week of incubation , and the morphology of the interorbital plate is best",N
439,seen that the only possible figures of equilibrium for a rotating mass are pseudo-spheroids and pseudo-ellipsoids . For an incompressible,mass,"the pear-shaped figures are unstable , so that spheroids and ellipsoids are the only possible figures of stable equilibrium .",N
440,concave edge looking obliquely forwards and upwards ; it nowhere reaches the edge of the pit ; the main otoconial,mass,"( ot . ) can be seen through the 44 fenestra . "" This operculated cleft in the 44 periotic",N
441,mass along the vertical through D should have a conductive power three times as great as that of the unstratified,mass,"along the vertical below C. This would seem absurd ; and , besides , all particular and restricted hypotheses of",N
442,"arise , and the coefficients of these new terms will be oi the second order of small quantities . The",mass,"of an harmonic inequality vanishes only to the first order , and it can no longer be assumed that the",N
443,"in this sense in which I have spoken of DE SAUSSURE'S sliding theory , as one which "" supposes the",mass,of the glacier to be a rigid one sliding over its trough or bed in the manner of solid bodies*,N
444,"between the two regions of the anterior sphenoid { o.s. , p.s. ) , and are confluent with the basal",mass,". So , also , is the orbitosphenoid confluent , above , with the top of the olfactory wall (",N
445,"comprehended under it . If from the formation of the solid shell , and from tte gradual dimninution in the",mass,"of the fluid nucleus , any change should be produced in the moment of inertia of the whole mass with",M
446,and supra-lingual cartilages ; lower view 33 3 The same ( large specimen ) ; hinder part of lingual muscular,mass,"with 2nd basi-branchial li 33 4 The same ( large specimen ) ; supra-lingual apparatus , with teeth 2 33",N
447,"of y and z are respectivelyfy andfrz . Now Ax , By , Cz , are the attractions of the",mass,"of the ellipsoid ; wherefore the total forces urging the point in the surface are Ax , ( B-f)y ,",M
448,"along , until Professor Huxley showed their true nature , been regarded as processes growing forwards from the "" investing",mass,". "" In my description of the Frog 's skull the mandibles are , on account of the suppressed and",N
449,"only 14 grains of solid matter , -for to this they were reduced by thorough drying . Yet this small",mass,"of matter gave sharp shocks , converted needles into magnets , affected distinctly the multiplier , and acted as a",N
450,"portion of oviduct two or three inches long , in water heated to lo ? , swelled out into a",mass,"of transparent jelly which filled a half pint tumbler , and all traces of the coats of the oviduct were",N
451,"equal to , and Sp varies as Sw , so that *This is not to be confused with , the",mass,"of the isothermal sphere . A SWARM OF METEORITES , AND ON THEORIES OF COSNIOGONY . or Now it is",M
452,"to symmetry of arrangement . In crystalline bodies , on the contrary , the particles are symmetrically arranged ; the",mass,"appears as if built up according to certain architectural rules , and the result is an exterior form whose angular",N
453,"peculiarly long and slender , and forms an acute angle with the condyloid part ( . ) , a semi-oval",mass,"of cartilage . The tip of the coronoid process is also cartilaginous , and so is the edge of the",N
454,"might be worth while to publish my solution , together with some recent additions thereto . If a corpuscle of",mass,". moving with velocity impinges on a plane surface , so that the inclination of its di1ection of motion before",M
455,"of fire from without , some portion must be inflamed by access of fire , and the combustion of the",mass,"thus brought about before it can be raised to the temperature of explosion . Subsequent experiments , however , clearly",N
456,". E. H. GRIFFITHS ON THE VALUE OF One assumption underlies all the calculations , viz. , that whatever the",mass,"of contained water , the water equivalent of bhe calorimeter remains constant . * find this assumption is not correct",M
457,"of its angular velocity , and as the angular velocity is inversely proportional to the moment of inertia of the",mass,", we shall have m=m'(-I )2 I ' representing the moment of inertia of the mass in its state of",M
458,"a certain determinate position to the mass under its influence , so that a given line in relation to the",mass,is brought by it into a given relation with the direction of the external magnetic power . 2551 . I,N
459,by the energy were 30 grammes instead of 3 . It must necessarily be obscure as to how a small,mass,"of solid matter take up a very large amount of energy in a small fraction of a second , but",N
460,becomes integrable . Suppose h is the mean value of k from O=a to O=a+p ; then Attraction of whole,mass,standing on the compartment BBIC'C C08`2 ( 1a+gsinlj* ( 2 . sin ( a2+ By this approximation the attraction of,N
461,masses are still at a considerable distance apart . It amounts to exactly the same whether we consider the larger,mass,"to be rigid , or whether we treat it as liquid and agree to disregard the instability which arises from",N
462,. The internal carotid artery ( i.e. ) finds its way into the pituitary space ( p.t.s. ) through a,mass,of soft fibrous stroma . On the outer side of the primordial skull other parts can be seen ; this,N
463,postpituitary mass ( Plate XIII . fig. 3 ) . The embryonic skull explains this ; for after the investing,mass,"has increased around and in front of the pointed end of the notochord , it gradually , whilst separating that",N
464,", which grow out right and left from the summit of the rangiophore . The shaded cells are the sporogenous",mass,", and the arrangement of walls supports rather than discountenances the view that the arcliesporium is not ned by the",N
