,Context before,token,Context after,Sense
1050,"in a weighed quantity of the liquid dissolved in butyl alcohol ( weight of nitrite taken , 0*1513 grm. ,",weight,"of nitrite calculated from the amount of iodine liberated , 0 1512 grm. ) . Its relative density was 0'891",M
1051,"tended to corroborate than to contradict , )lI could not conceive any other cause for the augmentation of the apparent",weight,"of water , upon its being frozen , than the loss of so great a proportion of its latent heat",M
1052,"INTERMOLECULAR DISTANCE . If we denote the specific gravity of a substance by , and . A represent the atomic",weight,", the intermolecular distance will be proportional to It is natural to suppose that as diminishes the elasticity will increase",M
1053,"I found that graphite , when heated with a mixture of nitric acid and chlorate of potash , increased in",weight,", and that the substance formed was , on the application of heat , disintegrated with evolution of gas .",M
1054,from the volume of gas in the flask . In order to connect the weight of the aluminum with the,weight,"of the hydrogen , the latter being obtained from its obsel.ved volume and RLGNAULT'S ation of its density , it",M
1055,following the changes of temperature during the time occupied by the comparisons . The effect of temperature on the apparent,weight,"of any object appears to be due to currents of air ascending or descending , according as the weight is",W
1056,"than 10 per cent. upon the present weight of hull . Making this correction , ( 1 ) will become",weight,"of hull I1X 188-75b =207T625b , and the equation ( A ) being modified accordingly leads to the quadratic 13.2b2-422-37b",W
1057,but recovered their colour on cooling . 23-57 grains by exposure to a red heat lost 0'57 grain of their,weight,. Hence the constitueints of the salt are 223 1 atom chromate of potash 12-5 i atom chromate of soda,M
1058,"column is the inside diameter of the tube , expressed in decimals of an inch ; the second is the",weight,of a quantity of quicksilver sufficient to fill one inch in length of it ; and the third is the,M
1059,"- . , ; _ - ' ; ?-r.^t : ^ ' ; 3 . ? V ' ^ ;",weight,"of oxalate Specific graWeight of oxalate ; Specific gra "" of aimonia n iob vity of the so.ofammonia in -dioity",W
1060,"out that the absolute effect in each wire is a diminution of resistance . 151 . Again , a heavier",weight,was applied so as permanently to elongate the wires . direction to the system . The strongest current through the,W
1061,"40 minutes , and after having been kept in cold water for 30 minutes , again tested for loss of",weight,". As the temperature of the water varied very little during the periods of observation , we see that the",M
1062,"water . According to the average of the whole proportions , sulphate of magnesia is replaced by 5*87 times its",weight,"of water . While in the later observations of the same TableIn 2 per cent. solution , 1 sulphate of",M
1063,"oxides of mercury and copper , and passing the gases over red-hot metallic copper . Analystsi ( 1 ) .",weight,of nitride taken=O-2683 grm. Observed vol. of nitrogen ( measured dry ) . Pressure . Temp. Vol. at 00 and,M
1064,"body as before , notwithstanding the fact that at some parts of the middle body there is an excess of",weight,. The amount of the greatest bending-moment when the ship is light is ako somewhat greater than that when she,W
1065,"in the form of products whose formation does not add , in so high a proportion , to the original",weight,"of the cotton as does the production of trinitro-cellulose . It follows from the above results , obtained by treatment",M
1066,) . This is an error inherent in the method . Its effect on the result varies with the,weight,"of the leaf and the duration of the experiment , and must , therefore , be estimated for each experiment",M
1067,"weigh 1062/ 5 Troy grains , which comes near to the Ptolemaic standard . But the coins require a greater",weight,", and the Eginean Mina should weigh 1662/ 3 Attic drachms . The Euboic Talent certainly came from Asia ;",M
1068,"R *STAS'S numbers are here used , viz. 0= 16 , Ag = 1O7e93 , Cl = 35.457 . Nos.",weight,of trichloWeight of vanadium Percentage of ride taken . pentoxide found . vanadium . 1 . 1-4188 07368 29 20,M
1069,inch f 068 and the specific gravity of the wire is 847 Table Il . Showing the Correction of the,weight,"of the Sphere in Air , on Account of the Weight , or Heat , of the Atmosphere . Barometer",W
1070,"heat lost , produced no sensible difference on the weights of the fluids in question . Had any difference of",weight,"really existed , had it been no more than one millionth part of the weight of either of the fluids",M
1071,of Human Respiration . the influence of food and changes of atmospheric pressure on the volume of air breathed and,weight,"of C02 expired . Two persons , my assistant , Mr. 0 . F. Townsend , and my laboratory attendant",M
1072,matter brought in contact with the substance . Every care should be taken to avoid contamination : 24 parts by,weight,"of the silicate are equivalent to 16 parts , or one proportional of silica , and 8 parts of protoxide",M
1073,", I think , be given than that afforded by the ' Bellerophon , ' which has an excess of",weight,"over buoyancy amounting to 250 tons at the middle , and yet no sagging-strains at any portion of her length",W
1074,were exposed to air in a room where they parted very slowly with the water by natural evaporation . Their,weight,"was determined at the commencement of the experiment , and their power of inflaming was tested by pressing a red-hot",M
1075,"rod of deal , similar to the last , also cut across the grain : Medium of l YOUNG'S modulus",weight,"Extreme communicaLimits of temperaLinear contracof elasticity or Remarks o the conition of of rod Tesinlength of rod , Remarks on",M
1076,"over 300 grm. , so that the results have no bearing upon Paton 's assertion that in guinea-pigs below that",weight,thymusless animals tend to have larger testes than normal individuals . In the two pairs killed below 300 grm. the,M
1077,"is more than DETERMINED BY EXPERIMENTS UPON RABBITS , GUINEA-PIGS , AND MICE . 153 Table XVII . No. Body",weight,". ( "" Rohgewicht . "" ) Blood volume observed . Blood volume calculated . b = wit ( k",M
1078,", the weight of the barrel , the length of the rods by which it is suspended , and the",weight,"of the bullet remaining the same , and this whatever the charge of powder may be that is made use",M
1079,"the twelfth day 's exposure . After three weeks ' exposure , the specimens had lost 30 per cent. in",weight,", and were converted chiefly into soluble gun-cotton . Experiment 112.The protracted exposure of air-dry gun-cotton to a temperature ranging",M
1080,"being a bulky material ) , it was found impossible to detonate mixtures containing more than one fifth part by",weight,of the diluent by means of one grain ( *065 grm. ) of mercuric fulminate confined in a copper capsule,M
1081,"and 35 ' inches , giving an average of nearly 34inches . The total averages of age , height ,",weight,", and girth were 23 years , 66*1 inches , 134 lbs. 83 oz. , and 34inches . They had",M
1082,The results thus obtained will be approximately correct over a moderate range of weight . But as the range of,weight,"increases the results deviate from the true values , and those obtained with = S deviate more rapidly than those",M
1083,which no weight appears ; for it is the symbol of that weight which is the result of removing the,weight,"A from the weight A , in other words , -x is the symbol of the ; weight A without",M
1084,"filter by artificial heat , its colour becomes a good deal darker , and it retains almost exactly half its",weight,"of water . When it is dried in the open air without artificial heat,.-3ths of its weight are water .",M
1085,' 1 ' Difference between cross-section calculated and observed . Cross-section calculated as percentage ( 0 *908 ) of body,weight,. Difference between cross-section calculated and observed . 1 8 grin . 70 mm. 0 605 sq . mm. 1,M
1086,"it as in the former experiments . The weights in the first column indicate the insistent weights , and the",weight,in the second column the moveable weights . The experiments were made when the temperature of the atmosphere was about,W
1087,"a sectorial inequality , but to find it generally involves the solution of a cubic equation . DUE TO THE",weight,"OF CONTINh'NTS . The point at which this maximum is reached is given in each case , and Plate 20",W
1088,"that of silk as 1000 to 1734 ; its surface , therefore , is to the surface of an equal",weight,"of raw silk in the compound proportion of 2 to 1 , and of 1734 to 1000 ; that is",M
1089,"temperature of the atoms , and fractions of atoms , through 1 ? "" . If A is the atomic",weight,"and C the specific heat of a compound , :a , , a2 , a3 ... . the atoic weights",M
1090,"mention that a candle-flame brought within a few inches of the magnesium weight , or its image focused on the",weight,"and alternately obscured and exposed by a piece of card at intervals of one second , will soon set the",N
1091,"because the gold salt is easily crystallized , possesses a considerable degree of stability , and contains approximately half its",weight,"of gold , so as to offer the most favourable chance of determining with accuracy the ratio between the metal",M
1092,"pressure approaches to the crushing force . Considering then the pillar as having two functions , one to support the",weight,"and the other to resist flexure , it follows , that when the material is incormpressible ( supposing such to",W
1093,", and the rear gold coins now remaining with the numerals XX , and XXXX , which answer to the",weight,"of one , and two ancient Roman Scruples . These have the head of Mars on one side , with",M
1094,"a gravitating substance , the same quantity must always belong to the globe , it becomes difficult to allow much",weight,"to the arguments of the Wernerians or Neptunists , who have generally neglected , in their speculations , the laws",MET
1095,is showrn that Sachs ' results would have been approximately the same had he measured carbon content instead of dry,weight,", all other details of his method remaining the same . On the other hand , shrinkage in area due",M
1096,"proportion of tin than is generally contained in celt metal ; that is , with one-sixth or oneseventh of its",weight,"of tin , is fitter for cutting instruments , and piercing , boring , and drilling tools than celt metal",M
1097,") In homologous series , or in series of related substances , the viscosity is greater the greater the molecular",weight,. ( 2 ) An iso-compound has always a smaller viscosity coefficient than the corresponding normal compound . ( 3,M
1098,"Trans. A. Vol. 202 , PI . 3 . Figure . Atomic percentage of tin . Per cent , by",weight,of tin . Magni- fication . Method of cooling the ingot . Method of etching . Description . 36 Sn,M
1099,"separately , and at different periods ; proving still farther the soundness of the foregoing reasoning , giving a greater",weight,"to the present observations , and explaining a number of cases in the ordinary process of generation , which have",MET
1100,in the experiments of this last series it seems most likely that they would affect the exact determination of the,weight,"of the precipitated gold , either by mechanical loss of some minute particles of the metal , tending to lower",M
1101,". , i-t is soluble in nitric , sulphuric , and muriatic acids . Nitric acid , diluted with its",weight,"of water , when poured upon the substance recently removed from the oviduct , 7changes its colour to a deep",M
1102,h* ! Difference between cross-section calculated and observed . Cross-section calculated as percentage ( 1 *41 ) of body weight,weight,. Difference between cross-section calculated and observed . A 1-2 grm. 470 mm. 1 49 sq . mm. 6 69,M
1103,"was suspended , when I found that the bottle A had augmented its weight by 3 part of its whole",weight,"at the beginning of the experiment ; the weight of the bottle with its contents having been 481 1,23 grains",M
1104,endeavour to determine its breeding season and period of utero-gestation . TABLE I. Kind . When caught . Number of,weight,of each Eggs . Egg tried . grains . Tremola . March 30 . 8 200 200 Tremola . May,M
1105,"29488 lbs. But we have seen above , that a uniform hollow pillar 2-02 inches diameter , and 36lbs .",weight,", would require 30518 Ilbs . to break it . Therefore these pillars , like the former ones , are",W
1106,"to examination are added , with a Table specifying the sex , age , \amp ; c. of patients ,",weight,"and composition of the specimens , \amp ; c. A second Table shows an arrangement of the ascertained ingredients in",M
1107,of potassium formed . I thought that by ascertaining the quantity of nitrogene evolved by the action of a given,weight,"of potassium , and comparing this with the quantity of oxygene disengaged from the oxide by water , I might",M
1108,"dried , it was found to have lost considerably in weight , and the finished product showed an increase of",weight,"upon the original cotton equivalent to 69 8 upon 100 , which was therefore 1-2 per cent. less than the",M
1109,"it from a weighing flask in which it had been cooled over phosphorus pentoxide , and noting the loss of",weight,of this flask . In applying heat to the crucible and its contents it was found necessary to heat gently,M
1110,"results , we appear to be justified in that the value of the viscosity coefficient depends not only on nolecular",weight,"and chemical constitution but also on molecular complexity . For liquids which probably contain simple molecules , or for which",M
1111,carefully before and after the air was forced through ; whereby it was found to have increased 1 grain in,weight,". The empty space in the cylinder was 248 grains , the difference of weight of which quantity of common",M
1112,", made from a distance with the aid of a small telescope . PROFESSOR J. W. MALLET ON THE ATOMIC",weight,"OF GOLD . piece of zinc was now made to slide down into the bulb , the end of the",M
1113,"H0 = 30-27 "" ; therefore the weight of 1 cubic inch of air = 03123 grain , and the",weight,"of S , vacuo , = 28440*778 grains . VOL , . LIX . m On the Weight of a",W
1114,266 0-533 Experiment 14 . | Initial weight . Final weight . Weight of testes . Initial weight . Final,weight,. Weight of testes . Control Animals . Operated Animals . grm. grm. grm. grm. grm. grm. 137 261 0-470,M
1115,of shell and nucleus ) of two hemispheric shells taken in an equatorial plane is equal to one half the,weight,of one hemisphere . 91 . Signor BELLI enters into several subordinate discussions as to the probable modifications of resistance,W
1116,length along the curve is to the breadth as 7P1 to 1 . Let b= half breadth extreme . w,weight,per sq . ft. of surface for hull . 9w ' = weight per sq . ft. of armour and,W
1117,"the weight of the sealed tube and its contents was taken , a drawn out end opened , and the",weight,quickly verified after equilibrium of pressure with the outside air had been thus established ; the tube was introduced into,M
1118,"; =I 333 KATEtRS CONVERTIBLE PENDULUM . Whence there appears , as the result of the experiment with the great",weight,"below , a difference of 14.88 vibrations per diem , corresponding to a difference of atmospheric pressure of 28.406 inches",N
1119,"chemical change , as regards weight , is a change in its arrangement and distribution . Now this distribution of",weight,"is subject to numerical laws , and the object of the present method is to facilitate the study of these",M
1120,experiment all the animals used were males . Experiment 1 : Effect of the Removal of the Testes upon the,weight,"of the Thymus and the Growth of the Animal.-\#151 ; In this experiment , 12 male guineaRelation between the Thymus",M
1121,"of all the othel to be employed , the specific gravity of each piece being mined befure comparison as to",weight,", so that the real values might all be referred to a ) ) calculation of the buoyancy in air",W
1122,that the body weight divided by the cube of the aortic radius was approximately constant over a wide range of,weight,". This he expressed in the formula W/ rz = K. The formula was purely empirical , and possessed no",M
1123,Weightofa.irdisplaced Volume.density . at Pan Therm. F. C. Barom. in . at C. millims. weight of glass apparatus preceding ),weight,of thallium nitrate in air . . W. CROOKES ON THE ATOMIC WEIGHT OF THAILIUM . The weight of air,M
1124,the curve of buoyancy with the curve of total weight of hull and equipment ; but the curve HH of,weight,"of hull has an interest attaching to it also , as it enables us to determine the straining-effect of the",W
1125,"portion of nitrate dried in a stove at a temperature not exceeding 1800 FAHR. , till it ceased to lose",weight,", was thereafter found to consist of Oxide of bismuth..,. . e 2124 100 Volatile matter . e e ...",M
1126,"of the day . Fig. 4 . Daily weight which , with a constant of 13 stones , represented the",weight,of the naked body . Fig. 5 . Hourly elimination of urea and urinary water under the influence of water,M
1127,"with about 52 feet of the after part unsupported , and remained in that position for thirty days . The",weight,"of the unsupported part may be roughly estimated at 440 tons , and the moment of this weight about the",W
1128,". In the first experiment the beam was 7 feet between the supports , but having yielded to the first",weight,", 3355 Ibs . , laid on , it was subsequently cut in two , as shown in the drawings",W
1129,"of alkali , and 6,85 of water . 100 gr. of crystallized digestive salt lose but 1 gr. of their",weight,"before the smell of the marine acid is perceived ; and hence they contain 7,85 gr. of water . But",M
1130,*45 . ) Difference between cross-section calculated and observed . Cross-section calculated as percentage ( 2 *16 ) of body,weight,. Difference between cross-section calculated and observed . 1 \#165 ; grms. 460 mm. 1 -81 sq . mm. 10,M
1131,"lie to the right of that for acebic acid , because from the measurenlents of RAMSAY and , the molecular",weight,"of liquid acetic acid is at all temperatures greater than that of formic acid , and its viscosity at any",M
1132,"3 , 04 , we shall have four equations of the form 01= Oo+ ( tto)+y(t--t0)2 ; and giving double",weight,"to the equation furnished by the epoch 1859.5 , inasmuch as it is derived from so much greater a body",MET
1133,", as in the instance of the strongest infusion , possessed slightly acid properties ; but more than of its",weight,"consisted of extractive matter . All the residuums in solution , as in the other cases , were precipitated by",M
1134,=2x = 83 Am Nominal horse-power =325x = 1350 H.P. Indicated horse-power=228x 9450 Weight of hull =214V2.v= 12570 tons .,weight,of engines =32-5x 1350 Weight of coals =32-5x 1350 Weight carried 2000 Total displacement. . 17270 tons . Taking next,W
1135,C 19\#151 ; 26 3460 194-7 1-20 5-62 From this table it is obvious that as the animals increase in,weight,they have a greater and greater percentage of blood . This difference is so regular and marked that it cannot,M
1136,", _+ -X - , ,V ) -+ =-X . ( 5 ) Now , let W be a compound",weight,", of which certain portions of matter named A and B are the components ( Sec. I. Def. 7 )",W/M
1137,adopted it as the material for a copy of the kilogramme . The only objection to the use of a,weight,"made of quartz is , that on account of the large amount of air displaced , the barometer and thermometer",N
1138,"ways according to the object in view ; as the absolute w'eight in grammes , and ' as the relative",weight,in reference to the weight of some one unit assumed as the standard of comparison . For this purpose the,M
1139,at which price it remained during the continuance of the republican government . But we are little interested in the,weight,of the Denarius for the first sixty years after it was coined ; and I have shown that when the,M
1140,"is well known that at the institution of the metrical system at the end of the eighteenth century , the",weight,of the kilogram was declared to be equal in vacuo to the weight of a cubic decimetre of water at,W/M
1141,"absolutely accurate . As to the limit of accuracy of the weighings in the 600 ft.-lb . trials , the",weight,of water dealt with was approximately 470 lbs. On this quantity the maximum probable error was 0'02 lb. in any,W
1142,"regard to one another which have no common component . 9 . An "" integral compound weight "" is a",weight,"which is composed of an integral number of simple weights . It is necessary to select a "" unit of",W/M
1143,to the equation connecting the logarithms of numbers ; and the relation which subsists between the absolute weight ( or,weight,in gram mes ) of the ponderable matter of which x and y are the symbols is the same as,M
1144,stretching . Ratio of weight specific resistance with weight on to that before any weight was applied . Ratio of,weight,specific resistance with weight on to that after the weight had been taken off . Ratio of weight specific resistance,W
1145,", and some of the houses had had their roofs perforated by falling stones . Others had collapsed under the",weight,"of ash that accumulated on them . No buildings , however , had been set on fire , though on",W
1146,"pound is now for the first time defined , and the measures of capacity are made to depend upon the",weight,"of water they contain ; the imperial gallon , containing ten pounds avoirdupois of water , having been declared to",M
1147,"than Group A , the average weight of which is 2103 grammes , and Group C , of an average",weight,"of 3460 grammes , about 33 per cent , more blood than Group A. If calculated on the other hand",M
1148,) Difference between blood volume calculated and observed . Blood volume calculated ag per cent. ( 4-39 ) of body,weight,. Difference between blood volume calculated and observed . A 1\#151 ; 4 grammes . 1545 c.c. 76-0 c.c. 76,M
1149,"and compute the force required to burst the barrel , it will be found equal to the pressure of a",weight,of 41o624 ? lbs. instead of 4368oo as before determined . For it is the resistance-or force of cohesion of,W
1150,"Weight of hull . 7100 tons . 4460 tons . Weight of armour and backing . 5190 , , 3630",weight,"of engines and coals 2160 , , 2160 Weight of stores carried . 1000 , , 700 Displacement. . 15450",W
1151,. ) Length 60inches . ( Table IV . ) Length 30T inches ( Table I. ) Diameter . Breaking,weight,. Diameter . Breaking weight . Diameter . Breaking weight . inch . lbs. inch . lbs. inch . lbs.,W
1152,is multiplied into the relative density of air and steam . As the correction results in a greater apparent increased,weight,"of the filled sphere on the admission of steam into the calorimeter , the correction is subtractive . 6 .",W
1153,"to k x , then instead of B E , Ll will become the Line of Direction of the compound",weight,", whose Action will be increased in the Ratio of LC to B C. This is what has been explained",W
1154,"weight 6 , 12 , with the weight 12 , 2A . If , however , xee assume the atomic",weight,"of graphite as 33 , we have for the product of the specific heat into the atomic weight the number",M
1155,"when they are fired with powder alone , recoil as well as when their charges are made to impel a",weight,"of shot , though the recoil is not in the same degree in both cases . It is easy to",W
1156,there is reason to think this communication may prove a valid contribution to the important and interesting subject of the,weight,"of the brain in the different Races of Man . POSTSCRIPT . [ Received July 31 , 1868 . ]",M
1157,". In respect of the acceleration of the pulse , the power of the nitrites is directly as their molecular",weight,", and inversely as the quantity of nitroxyl they contain . They , therefore , fall into an order of",M
1158,"of powder , was a piece of ordnance , of greater or less dimensions ; , or greater or less",weight,", according to the force of the charge ; placed vertically upon its cascabel , upon the steel hemisphere which",W
1159,? 1003 1004 1005 1006 1007 1008 1009 1-010 1011 1-012 1013 1014 1015 1016 1017 1018 1019 Abscissae show,weight,"specific resistances , assuming the value before stretching as / OOOOO Curve of results given in Columns 2 and 3",W
1160,". 43 6562 , , Hence the weight of vanadium pentoxide taken -5 1895 grms. lost 00004grm . , a",weight,"perfectly appreciable with the balance employed , but without influence on the results . STAs likewise noticed a regular decrease",M
1161,"x I273 , and I.H.P..2 73b'(2d ? b ' ) 20000 1'82b'(2d ? b)s3 and nominal H.P. 20000 1-82b'(2d+ b')s",weight,"of engines and coal.= 10000 Hence we have , equating the two expressions for the displacement , as before ,",W
1162,"same laws of dikeresis and synthesis as all other chemical substances . On these ideas , as we regard the",weight,"of two volumes of oxygen , that is to say the weight of a molecule of oxygen , 02 ,",M
1163,"is seen that when the blood volume is calculated as percentage of body weight , the greater the range of",weight,of the animals experimented upon the greater is the average difference between the calculated and observed values . This is,M
1164,"was able to sustain a weight of I iglbs avoirdupois , without breaking . This gives 63,466 lbs. for the",weight,"which a cylinder of the same iron whose transverse section is one inch , would be able to sustain without",W
1165,"TXj its weight of tin , in the state of ingot 8,760 6 . Allay of copper with a its",weight,"of tin 8,7co Ditto , another piece of the same ingot 8,677 7 . Allay of copper with =Lo its",M
